,Job Title,Salary Estimate,Job Description,Rating,Company Name,Location,Headquarters,Size,Founded,Type of ownership,Industry,Sector,Revenue,Competitors
12,"Data Scientist, Growth",-1,"Coursera was founded by two computer science professors at Stanford with a vision of providing life-transforming learning experiences to anyone, anywhere. It is the world’s largest online learning platform for higher education. 200 of the world’s top universities and industry educators partner with Coursera to offer courses, Specializations, and degrees that empower over 48 million learners around the world to achieve their career goals. Over 2,200 companies use the company’s enterprise platform Coursera for Business to transform their talent. Coursera is backed by leading venture capital firms such as Kleiner Perkins Caufield & Byers, New Enterprise Associates, GSV Capital, International Finance Corporation, Laureate Education Inc., and Learn Capital.

At Coursera, our Data Science team is helping to build the future of education through data-driven decision making and data-powered products. We drive product and business strategy through measurement, experimentation, and causal inference. We define, develop, and launch the models and algorithms that power content discovery, personalized learning, and machine-assisted teaching and grading. We believe the next generation of teaching and learning should be personalized, accessible, and efficient. With our scale, data, technology, and talent, Coursera and its Data Science team are positioned to make that vision a reality.

We’re looking for a talented, creative, and driven data scientist with a sharp eye for UX design, strong algorithmic and analytic skills, and an interest in expanding the reach and quality of online education. Our ideal candidate is an independent, analytically-minded individual with strong analysis and statistical modeling skills, who shares our passion for education.


Your Responsibilities
Modeling user behavior to identify and prioritize product and business opportunities to drive growth of degrees
Building predictive models to identify and nurture potential degree learners
Designing, testing, and implementing high leverage degree growth interventions
Working cross-functionally with engineers, designers, and product managers on our core degree products
Your Skills
Background in applied math, computer science, statistics, or related technical field, and 2+ years of industry experience
Strong skills in applied statistics, data visualization, and predictive modeling
Strong product intuition and cross-functional communication skills
Proficient with at least one scripting language (e.g. Python)
Proficient with at least one statistical software package (e.g. R, NumPy/SciPy/Pandas)
Proficient with relational databases and SQL
Excellent communication and project management skills

Coursera is an Equal Employment Opportunity Employer and considers all qualified applicants without regard to race, color, religion, sex, sexual orientation, gender identity, age, marital status, national origin, protected veteran status, disability, or any other legally protected class.

If you are an individual with a disability and require a reasonable accommodation to complete any part of the application process, please contact us at accommodations@coursera.org.

Please review our CCPA Applicant Notice here.",3.9,"Coursera
3.9","Mountain View, CA","Mountain View, CA",501 to 1000 employees,2012,Company - Private,Colleges & Universities,Education,Unknown / Non-Applicable,-1
13,AppD Data Scientist Master's (Intern) United States,-1,"About Us

AppDynamics is the Application Intelligence company. With AppDynamics, enterprises have real-time insights into application performance, user performance and business performance so they can move faster in an increasingly sophisticated, software-driven world. Our integrated suite of products is built on our innovative, enterprise-grade App iQ Platform that enables our customers to make faster decisions that enhance customer engagement and improve operational and business performance. AppDynamics is uniquely positioned to enable enterprises to accelerate their digital transformations by actively monitoring, analyzing, and optimizing complex application environments at scale which has led to proven success and trust with the Global 2000.

About the Role:

As part of Data Science team, the Intern will work on developing python scripts for data gathering and analysis. He/she will work under the supervision and receive mentorship from data scientists and/or data engineers.

A successful candidate is expected to have background knowledge in machine learning and statistics, be skilled at python programming, and be comfortable working in a dynamic and fast-paced environment.

Responsibilities:
Develop Python for gathering, transforming, and analyze data
Prototype data science algorithms supporting product feature development
On demand data exploration to support various business cases
Experience and Skills:
B.S. or current enrollment in Computer Science, or related field
Experience with Python and machine learning
Good verbal/written communication and multitasking skills
Ability to present complex technical information in a clear and concise manner
Just a note

Note to Recruiters and Placement Agencies: AppDynamics does not accept unsolicited agency resumes. Please do not forward unsolicited agency resumes to our website or to any AppDynamics employee. AppDynamics will not pay fees to any third party agency or firm and will not be responsible for any agency fees associated with unsolicited resumes. Unsolicited resumes received will be considered property of AppDynamics.

AppDynamics is an equal opportunity employer and considers all qualified applicants without regard to race, color, religion, sex, sexual orientation, gender identity, national origin, disability, age, protected veteran status, or any other unlawful factor. AppDynamics complies with all applicable laws, including those regarding consideration of qualified applicants with criminal histories (such as the San Francisco Fair Chance Ordinance). If your disability makes it difficult for you to use this site, please contact recruiting@appdynamics.com. AppDynamics participates in E-Verify.
#appd_jobs",4.4,"AppDynamics
4.4","San Francisco, CA","San Francisco, CA",1001 to 5000 employees,2008,Company - Public,Enterprise Software & Network Solutions,Information Technology,$100 to $500 million (USD),-1
14,Data Scientist / Biostatistician,-1,"PicnicHealth is a San Francisco-based, venture-backed health tech startup with the mission of empowering patients by giving them the ability to own, use, and share their medical history, to cure their disease. We give patients the first truly useful personal health record by collecting, abstracting, their medical history, and providing it back in a unified timeline. With our research collaborations, patients can contribute their anonymized medical data to create research registries -- which allow Academic and Life Science companies to better understand disease, and how it manifests in the real world.

The Opportunity

At PicnicHealth, biostatistics and data science are at the core of how we transform Real World Data (RWD) into insights for our research partners. We're seeking an experienced data scientist or biostatistician to deliver that insight on a daily basis to achieve both internal, and external research goals. Unlike clinical trial data, RWD is non-randomized, and has a unique set of challenges that you would be a key proponent in solving. As an early member of our Research team, you will have the flexibility and remit to work on all aspects of research product and scientific portfolio, bringing a lasting impact on the future of PicnicHealth.

Our ideal team member will have biostatistical experience, with curiosity and ability to find creative solutions to meaningful clinical questions. You are an analytical thinker with experience working with RWD. You are excited by the prospect of rolling up your sleeves to tackle meaningful problems each and every day. You are a kind, passionate, and collaborative problem-solver who seeks and gives candid feedback. You are motivated to be amazing in your role and, ultimately, to improve patient care.

As a Data Scientist / Biostatistician at PicnicHealth you will:
Use PicnicHealth's large, multi-disease real-world dataset to answer some of the most critical clinical questions
Become a subject matter expert on our data and its capabilities
Transform real-world clinical data into actionable insights using machine learning, robust statistical methods, and compelling data visualizations in formats accessible to a wide range of end users
Work with a cross-functional team to define and clarify analytic requirements, develop analysis plans, ensure data quality standards, and create publication-ready methods and results
Generate ideas for analyses to shape future projects
Collaborate with a team of clinicians, product managers, and software engineers to help develop, commercialize, and deliver analytics products
Lead technical initiatives that further our understanding of RWD and methods to generate real world evidence
Contribute to the growth and development of the PicnicHealth team by mentoring fellow team members and participating in recruitment efforts
Develop and manage relationships with external partners (including life science companies, regulatory agencies, academic institutions, and health technology assessment bodies) to advance the integration of our analytic products through demonstrated value
Publish scientific work in peer-reviewed journals
You're a strong candidate if:
You hold a Master's degree with 4 years of industry experience or PhD (or equivalent) in a quantitative discipline, such as biostatistics, epidemiology, applied statistics, health economics, or a related discipline
You love working with data and have experience exploring it with a critical and thoughtful eye
You are proficient in R/Python/SQL (or another programming language and are committed to becoming an expert in R/Python and SQL)
You are an excellent communicator, both oral and written, and can effectively adapt your tone, content, and approach to diverse audiences
You are self-motivated, flexible, proactive, and enjoy coming up with elegant and innovative solutions to challenging problems
You know how to balance attention to detail with execution against tight timelines
You are passionate about our grassroots patient-centric mission to improve healthcare through technology
You are an ideal candidate if you also have experience:
Consulting in the life sciences
Working with longitudinal EMR data",5.0,"PicnicHealth
5.0","San Francisco, CA","San Francisco, CA",1 to 50 employees,2014,Company - Private,Computer Hardware & Software,Information Technology,Unknown / Non-Applicable,-1
