,Job Title,Salary Estimate,Job Description,Rating,Company Name,Location,Headquarters,Size,Founded,Type of ownership,Industry,Sector,Revenue,Competitors
6,Senior Data Scientist,-1,"Our Mission

We make it fly! Join us and build the future of aviation, changing the way people and goods move around the world.

Soon, aircraft will deliver packages to your doorstep, air taxis will fly you around cities, and emergency medicine will be flown more quickly to accidents.

We're building the digital traffic management to make it all possible.We’re a diverse crew of aviation enthusiasts, Bay Area startup veterans, and professionals from multiple industries who’ve come together to build really cool things.

Want to help us usher in the era of flying cars?
Going beyond developing software, hardware, and aircraft, we aim to build a unifying vision and suite of products that enable the next generation of aviation. As a fast-moving, iterative team and a leading innovator in aerospace, our goal is to leave a lasting impact by updating how objects, information, and people move in a new, exciting world.

Data Scientist

We’re using large datasets of real UAS flights to create and validate risk models that our services will use to ensure safe operations. You’ll work with our partners to onboard data to an architecture that you specify, including designing and implementing ETL processes, auditing processes and analytics frameworks.
Set up our database infrastructure and data pipeline, managing all aspects from ingest and ETL to advanced analytics.
Determine the best algorithms to apply to the data, including machine learning tools as appropriate.
Working with our statisticians, create computational models for vehicle behavior and performance.
In collaboration with the Safety & Risk Architect, you’ll identify safety-related trends and determine the best way to represent them in the Open Risk Framework and underlying risk models.
Collaborate with development engineers to incorporate your models/pipelines/architectures into deployed products.
Qualifications:
BS, MS or PhD in Statistics, Computer Science, Data Science or a related field.
Extensive experience working with various data sets, knowledge of state of the art in machine learning, and understanding of the power and shortcomings of data
Experience using TensorFlow or other large scale machine learning frameworks in production
Extensive experience building, running and maintaining database infrastructure
Experience working with Hadoop, Spark and other tools for distributed computing is essential.
Additional Considerations:
Experience implementing best practices in data security, integrity, workflow traceability, and auditing
Experience with optimization and statistical data analysis tools
Experience with one or more programming languages (Python, R, Julia)
Your experience has been in the context of an early stage effort. This could be at a startup or a new project in a more established company.
Comfortable working as part of a cross-functional team with shifting priorities as needs change and new opportunities arise.
Experience with software engineering concepts in a small, tightly coupled team--and how these evolve with growth of the team
Deadlines are your friend, and you’re a natural communicator who can articulate bottlenecks and challenges.
Outstanding technical leadership and communication skills
Innate curiosity leads you to keep up with the latest research, news and developments in your field.
If you’ve published journal articles, conference papers or technical reports, that’s a plus. We expect you to share the insights, best practices and paths forward that you develop with the rest of the world, including at relevant industry conferences.
We're proud to be an equal opportunity workplace celebrating unique talents, backgrounds, and differences. We’re dedicated to building a healthy and sustainable culture, while solving big problems that really matter.

We take care of our people, offer work life balance, and offer neat perks like flight training!",3.6,"My Job Tank
3.6","San Francisco, CA","New York, NY",51 to 200 employees,-1,Company - Private,-1,-1,Unknown / Non-Applicable,-1
7,Data Scientist,-1,"Cape Analytics provides instant property intelligence for buildings across the United States. Cape Analytics enables insurers and other property stakeholders to access valuable property attributes at time of underwriting, with the accuracy and detail that traditionally required an on-site inspection, but with the speed and coverage of property record pre-fill. Founded in 2014, Cape Analytics is backed by leading venture firms and innovative insurers and is comprised of computer vision, data science, and risk analysis experts.

About the role:
We are looking for a Data Scientist with a scientific approach who has strong expertise in data analysis, statistics, programming, and machine learning to join our Data Science team. You will collaborate with Data Scientists, Computer Vision/Machine Learning Engineers, Data Engineers, and members across Software Engineering, Product, and Sales teams to build robust, scalable machine learning models for identification and annotation of the built world. Additionally, you will develop expertise in ground truth generation, model performance analysis, iterative model development, and unsupervised mapping of the feature space to bring scientific rigor, scalability, and robust performance to our core product offerings.
As a data scientist, you will:
Develop scientifically rigorous, creative methodologies to continuously improve our machine learning models.
Incorporate machine learning and data-driven decisioning into the core of our infrastructure.
Contribute to design and automation of model training, model post-processing and evaluation pipelines at scale.
Leverage the extensive data generated by Cape in addition to data from external sources to generate structured knowledge about our feature space.
Present your results internally and externally; Defend your methodology and incorporate feedback from internal teams as well as customers.
Improve model performance by identifying failure modes using supervised and unsupervised learning techniques.
Ideate and implement data-driven methodologies to help scale model performance across geographical, climatic, and temporal dimensions.
Implement automated solutions for ensuring data quality and delivery.
Explore and mine new data sources that will help optimize and validate our models.
Link model capabilities to market needs by customizing models, designing and running validation studies.
Contribute to peer mentorship, knowledge bases, and skills transfer.
Skills / Requirements:
Graduate degree and 1-3 years of hands-on industry experience or a PhD.
Solid knowledge of statistical techniques, including hypothesis testing, statistical sampling, significance testing, statistical inference, maximum likelihood estimation, and experimental design, among others.
Mastery of, supervised and unsupervised algorithms and their implementations, machine learning concepts including regularization, learning curves, optimizing hyperparameters, cross-validation, among others.
Advanced knowledge and significant programming experience in Python programming or other scripting language including relevant libraries like numpy, pandas, SciPy, matplotlib.
Familiarity with the Linux environment including shell scripting, Git and tools for reproducibility (e.g. virtual environments, Docker ).
Demonstrated expertise in building data tools for ETL and data analysis.
Experience in building meaningful data visualizations using at least one scripting-based visualization tool such as matplotlib, d3.js or bokeh
Nice to haves:
Experience designing data schemas and extracting data from SQL and NoSQL databases.
Experience with GIS systems.
Experience with modern data technologies, e.g. Spark, Tensorflow, Jupyter Notebook, Docker.
Experience with cloud computing on AWS or GCP.
We believe:

*Talent is critical, but best when tempered with humility
*Self-motivation leads to the best outcomes
*Open, direct communication is a sign of respect
*Teamwork drives success
*Having fun together is an important part of the job

***Cape Analytics is an E-verify participant.***",5.0,"Cape Analytics
5.0","Mountain View, CA","Mountain View, CA",51 to 200 employees,2015,Company - Private,Enterprise Software & Network Solutions,Information Technology,Unknown / Non-Applicable,-1
8,Data Scientist - Social and Search Intelligence,-1,"Beam is disrupting a $7.5 billion compliance software market. Beam's scalable technologies incorporate new data sources for our bank and fintech partners, helping make the financial system safer while maximizing the value and utility of critical compliance resources. As an engineer at Beam, you will be building large scale, comprehensive, elegant, and easy to operate compliance solution for fintechs, large banks, small banks, credit unions, and broker-dealers.

Beam is a rapidly growing venture-backed startup led by industry veterans. With a strong product vision and an experienced development team, our product has been well-received by customers and we're excited to grow. As a member of the engineering team at Beam you will be a critical asset responsible for many tasks and systems that span our entire product and internal infrastructure. As part of the R&D team you will be part of shaping the technological landscape, build new products, add and improve features, and scale and maintain the systems that keep our customers happy. You will also build internal tools and systems to help streamline and optimize internal initiatives.

We are looking for a seasoned Data Scientist with experience building and automating web crawling and data ingestion pipelines. You will be responsible for streamlining, automating and integrating the collection and delivery of structured and unstructured data that will drive Beam's internal intelligence suite to produce sophisticated features for machine learning and data analysis. You feel comfortable switching hats between software development, gathering business requirements, and devops tasks. You take pride in owning and maintaining the technical work environment. You enjoy learning new technologies and sharing your code with others. Lastly, you have been looking for an opportunity where you can use your passion and skills for a greater good against financial crime.

Our main office is located in the Jackson Square district of San Francisco and we offer a generous full range of benefits.

Responsibilities
Collaborate with the R&D team to architect and build a distributed cloud-based SaaS solution for transaction monitoring.
Champion Beam's data intelligence efforts to scrape, ingest, and process external data sources. Your work will be consumed by Beam's internal intelligence suite to produce sophisticated features and by our customers' operational teams in form of tabular, geo-mapped, and image-like data.
Actively build and deploy cutting-edge search intelligence solutions.
Permanently identify efficiency opportunities to scale our product and the team behind it.
Explore, evaluate and integrate new data pipelines.
Skills and Experience
3+ years of applied data science experience
BS in Computer Science or a related field. Master's degree a plus.
Proficient in machine learning and ETL frameworks using Python / Spark
Hands-on experience in automation and web crawling/web scraping in Python, JavaScript, or similar language.
Familiarity with Linux/UNIX, HTTP, HTML, and Javascript.
Strong understanding of building data pipelines and data lakes.
Expert in working with large scale data processing using Hadoop stack.
Solid understanding of NoSQL database modeling and design.
Experience with cloud infrastructures such as AWS and related big data technologies (Red Shift, DynamoDB, EMR, etc.)
Hands on experience working with social media data sources.
Strive in a fast-paced environment.
Business driven and result-oriented individual.
Obsessive in delivering quality software.
Passionate about open source.
Relentless in keeping solutions secure.
Effective communication & collaboration skills.
Extra Credit
Knowledge of software engineering best practices across the development lifecycle, including agile methodologies, coding standards, code reviews, source management, build processes, testing, and operations.
Experience with containerization related management stacks like Docker, Swarm, Kubernetes.
Worked in a financial services context related to risk management.
Open source contributor.
We are an equal opportunity employer and value diversity at our company. We do not discriminate on the basis of race, religion, color, national origin, gender, sexual orientation, age, marital status, veteran status, disability status, or any other protected characteristic. Pursuant to the San Francisco Fair Chance Ordinance for Hiring, Beam will consider for employment qualified applicants with arrest and conviction records.",5.0,"Beam
5.0","San Francisco, CA","San Francisco, CA",1 to 50 employees,2017,Company - Private,Enterprise Software & Network Solutions,Information Technology,Unknown / Non-Applicable,-1
9,Data Scientist (Multiple Levels),-1,"NerdWallet is seeking results-focused Data Scientists to join our team and drive efforts to develop machine learning models that improve product experience and personalization across our businesses. Data Scientists partner with product and marketing teams to understand and solve the most impactful problems and collaborate with other teams in the organization (Platform Engineering, Data Analytics, and Data Engineering) to understand and contribute to NerdWallet's machine learning and data platforms. The ideal candidates will be passionate about the personal finance space and NerdWallet's mission to provide clarity for all of life's financial decisions.

Where you can make an impact:
Deliver on high visibility data science projects that improve on the relevance of NerdWallet's financial advice to our customers
Collaborate cross-functionally with other data teams at NerdWallet to define best practices and leverage shared platforms, insights, and innovations
Own data and ML pipelines that empower product teams and increase the impact of data science
You are:


Creative problem solver: Passionate about answering questions with data and always learning
Structured thinker: Understand how to break down complex problems into the key components where data science and machine learning can be used to improve existing solutions
Highly productive: Able to execute efficiently on multiple projects. These roles are intended for people who are passionate about data and developing solutions to improve our products
Team Player: Excited to mentor junior team members and collaborate to develop cutting edge solutions that can be leveraged by others at NerdWallet
Consumer first and positive attitude: Motivated to work hard in a fast-paced environment – business decisions here can connect and impact millions of users
Your experience:


Advanced degree (MS or PhD) in a quantitative field
3-6+ (depending on level) years experience developing production ML models to solve problems such as product/content recommendations and user intent, engagement, or segmentation (preferably at a consumer technology company)
Proficient to expert level understanding of machine learning, feature engineering, and model evaluation techniques
Demonstrable programming skills (Python preferred)
Experience building production solutions with ML frameworks (e.g., TensorFlow, Spark MLlib, SciKit Learn, etc.) for real-time inferences
Hands-on experience in data technologies (SQL, AWS, Redshift, Snowflake, etc.)
Ability to work with data and machine learning engineers to implement ML pipelines
Experience communicating and collaborating with leaders across the organization, which include stakeholders in engineering, product, finance, and marketing organizations
What we offer:
Competitive compensation package
401(k) with company match
100% paid premiums for medical, dental and vision for employee and their dependents
Paid maternity and paternity leave
Commuter, gym and cell phone stipend
$500 enrichment stipend towards learning and development for your role
Catered lunches daily, free dinner, and kitchens stocked full of snacks
Onsite coffee bar with baristas
Company happy hours, social events and outings
Generous, flexible vacation
NerdWallet is committed to pursuing and hiring a diverse workforce and is proud to be an equal opportunity employer. All qualified applicants will receive consideration for employment and will not be discriminated against on the basis of any characteristic protected by applicable federal, state or local law.

#LI-DS1",3.4,"NerdWallet
3.4","San Francisco, CA","San Francisco, CA",201 to 500 employees,2009,Company - Private,Financial Analytics & Research,Finance,Unknown / Non-Applicable,-1
10,Data Scientist,-1,"About Netskope

Today, there's more data and users outside the enterprise than inside, causing the network perimeter as we know it to dissolve. We realized a new perimeter was needed, one that is built in the cloud and follows and protects data wherever it goes, so we started Netskope to redefine Cloud, Network and Data Security.

Since 2012, we have built the market-leading cloud security company and an award-winning culture powered by hundreds of employees spread across offices in Santa Clara, San Francisco, Seattle, Bangalore, London, Melbourne, and Tokyo. Our core values are openness, honesty, and transparency, and we purposely developed our open desk layouts and large meeting spaces to support and promote partnerships, collaboration, and teamwork. From catered lunches and office celebrations to employee recognition events and social professional groups such as the Awesome Women of Netskope (AWON), we strive to keep work fun, supportive and interactive. Visit us at netskope.com/company/careers and follow us on Twitter @Netskope and Facebook.

Data Scientist


Within Netskope Engineering, the Security Services organization is responsible for building core security products and features, such as Data Loss Prevention, Malware and Threat Prevention, Cloud Confidence Index, Breach and Anomaly Detection. We apply Artificial Intelligence and Machine Learning technologies across Netskope cloud security platform. We are looking for talented data scientists with security domain knowledge. A successful candidate has deep technical expertise in applying AI/ML technologies in security applications and/or adjacent domains, ideally has been through the entire lifecycle of an award winning security product, and must be passionate about cloud security. You will have the opportunity to work with a team of talented engineers, researchers and data scientists to solve the most challenging cloud security problems.

Responsibilities:
Identify strong AI/ML use cases in cloud security, data security and adjacent domains, leveraging Netskope's rich set of data sources;
Define scalable data acquisition and labeling strategy for specific use cases;
Work with data engineers to retrieve, clean and normalize data. Ensure scalable and continuous high-quality data stream;
Work closely with threat research and development team in feature engineering. Make sure high-quality feature sets are chosen in a systematic way;
Select ML models for defined use cases. Implement KPIs to ensure optimal algorithms and results;
Conduct strict internal testing to ensure high efficacy, low false positive and false negative rate;
Interpret results and communicate findings;
Document use case, data acquisition, feature engineering, training, validation, deployment, future improvement opportunity and other important aspects;
Work closely with development and QE team in productization;
Be an evangelist of AI/ML within Netskope. Promote AI/ML wherever applicable, beyond security use cases;
Collaborate with data analytics team to define new platform requirements and continuously improve our horizontally scalable data lake.
Qualifications/Requirements:


First of all, must have true startup spirit. Be willing to wear multiple hats and deliver end-to-end;
Ability of thinking out-of-box and evaluating results based on customer value;
5+ years of industry experience in applying AI/ML, preferably on well-known security products or services, such as malware detection, anomaly detection, security analytics and data security;
Experience of applying AI/ML in more than one domains highly desirable;
Hands-on experience with relevant technology stacks such as CUDA, Python, R, Spark, Flink, Tensorflow;
Hands-on experience using modern big data pipeline;
Natural language process (NLP) and data mining experience highly desirable;
Security research experience and strong security domain knowledge highly desirable;
Energetic self-starter, with the desire to work in a dynamic fast-paced environment;
Excellent verbal and written communication skills;
Ability to influence without authority
Education:


PhD in Computer Science, Statistics, Electrical Engineering or equivalent technical degree.
#LI-NW1",4.3,"Netskope
4.3","San Francisco, CA","Santa Clara, CA",501 to 1000 employees,2012,Company - Private,Enterprise Software & Network Solutions,Information Technology,Unknown / Non-Applicable,"Skyhigh Networks, Zscaler, NortonLifeLock"
11,Senior Data Scientist,-1,"LendUp is a financial technology startup based in Oakland focused on transforming the subprime credit and lending space. We’re a Y-Combinator alum (YC W12) backed by prominent investors such as Google Ventures, Andreessen Horowitz, Kleiner Perkins, and Kapor Capital. Our product is being used in 7 states and we’ve seen great press coverage in the Wall Street Journal, Financial Times, CNN, NBC, TechCrunch, Venturebeat, Inc, Wired, Bloomberg, Fortune, and Dow Jones, amongst others.

What we’re doing:

At LendUp we are on a mission to provide anyone with a pathway to better financial health. Millions of people don’t have access to quality credit. Their options are often limited and unfair, and it’s easy to become trapped in a debt cycle. This is the first problem LendUp set out to solve, by applying our combined expertise in software, data science, credit, and education, to our shared passion for financial health and dignity.

Our core product, the LendUp Ladder, is an alternative to payday loans that transforms a trap into an opportunity to borrow at lower rates and build credit. And every day, we see our customers succeed. We’re building additional financial products that will help us further accelerate our mission of providing anyone with a path to better financial health.

About the role:

As a senior data scientist, you help drive smart quantitative decisions across every part of the business. You provide expertise in using data, identify insights and patterns, and create compelling reports. You understand our business operations in detail and mentor other teams so they use data more effectively. You propose strategy for data innovation and help us find a way to help the tens of millions of Americans banks won’t lend to.

You will:
Dive into quantitative questions in every part of the business, at every level of the organization
Create queries, dashboards, and analyses to obtain insight about the health and operation of the business, and help drive decisions
Advise and mentor other teams and individuals on how to implement business logic in queries and make quantitative decisions based on deep understanding of the business
You have:
Advanced knowledge of SQL, database schema design, data warehousing, and query optimization
Experience in manipulating, visualizing, and providing analysis of data using SQL as well as other tools like Python or R.
A strong statistical background, and basic knowledge in machine learning and data science
A good understanding of business requests, crystalizing them into crisp requirements, and translating them into actionable analysis.
Strong communication and collaboration skills across multiple teams and stakeholders
Curious, creative and persistent
We have:

LendUp has all the things you’d expect from a mission-driven company, like a competitive salary; early stage equity; 100% company paid medical, dental and vision insurance; generous vacation/sick leave policy; catered, free lunch; kitchens fully stocked with snacks; 401(k).

But here’s what we really love about LendUp Life:
We’re committed to a diverse and inclusive culture that spurs innovation and creates a meaningful and impactful work environment
We have fun together at our bi-weekly happy hours, quarterly team building events, company-sponsored volunteerism, hackathons, and sports teams, including a few fantasy sports leagues
One of our values is “different backgrounds, same mission.” We are passionate about diverse candidates and have slack channels dedicated to everything from philosophy to sports to hip hop
LendUp is an Equal Opportunity Employer

We extend equal employment opportunities to qualified applicants and employees on an equal basis regardless of an individual's age, race, color, sex, religion, national origin, disability, sexual orientation, gender identity or expression, pregnancy status, marital status, military or veteran status, genetic disposition, or any other reason protected by law.",3.4,"LendUp
3.4","Oakland, CA","Oakland, CA",51 to 200 employees,2012,Company - Private,Lending,Finance,Unknown / Non-Applicable,-1
